{
  "$schema": "https://json-schema.org/draft/2020-12/schema",
  "$id": "urn:zero-one:behavior-contract:1",
  "type": "object",
  "description": "Testnet behavioral guarantee: every field is committed by SHA-256 of canonical JSON.",
  "additionalProperties": false,
  "required": [
    "schema_version",
    "contract_id",
    "chain_id",
    "promisor",
    "beneficiary",
    "patch",
    "replays",
    "bond",
    "oracle",
    "starts_at",
    "expires_at",
    "release_condition",
    "slash_condition",
    "dispute"
  ],
  "properties": {
    "schema_version": {
      "type": "string",
      "description": "Selects exact validation and adjudication semantics.",
      "const": "1"
    },
    "contract_id": {
      "type": "string",
      "description": "Distinguishes two independently bonded deliveries.",
      "minLength": 1,
      "maxLength": 128
    },
    "chain_id": {
      "type": "integer",
      "minimum": 0,
      "description": "Prevents signing or funding on mainnet.",
      "const": 84532
    },
    "promisor": {
      "type": "string",
      "description": "Identifies whose test coins are locked and returned on pass.",
      "pattern": "^0x[0-9a-fA-F]{40}$",
      "not": {
        "const": "0x0000000000000000000000000000000000000000"
      }
    },
    "beneficiary": {
      "type": "string",
      "description": "Fixes the recipient of compensation on failure.",
      "pattern": "^0x[0-9a-fA-F]{40}$",
      "not": {
        "const": "0x0000000000000000000000000000000000000000"
      }
    },
    "patch": {
      "type": "object",
      "description": "Pins the actual delivered binary instead of a mutable version label.",
      "additionalProperties": false,
      "required": [
        "artifact",
        "sha256",
        "source",
        "spring_boot"
      ],
      "properties": {
        "artifact": {
          "type": "string",
          "description": "Locates the binary; the CLI supplies the local mirror, checked by hash.",
          "minLength": 1
        },
        "sha256": {
          "type": "string",
          "description": "Detects replacement or mutation of the promised patch artifact.",
          "pattern": "^0x[0-9a-f]{64}$"
        },
        "source": {
          "type": "string",
          "description": "Identifies provenance in Compat Foundry.",
          "const": "compat-foundry/java-spring-trailing-slash"
        },
        "spring_boot": {
          "type": "string",
          "description": "Defines the upgraded runtime covered by this guarantee.",
          "const": "3.0.13"
        }
      }
    },
    "replays": {
      "type": "array",
      "minItems": 1,
      "maxItems": 1,
      "description": "Enumerates the covered catalog drift IDs; uncovered drifts carry no guarantee.",
      "items": {
        "type": "object",
        "description": "One executable clause with its acceptance oracle.",
        "additionalProperties": false,
        "required": [
          "drift_id",
          "command",
          "request",
          "normalization",
          "expected_output_sha256"
        ],
        "properties": {
          "drift_id": {
            "type": "string",
            "description": "Links to the existing 12-rule catalog, without implying all rules were replayed.",
            "const": "mvc-trailing-slash"
          },
          "command": {
            "type": "array",
            "description": "Records exact application argv; interpreter only accepts this allowlisted command, never a shell.",
            "const": [
              "java",
              "-jar",
              "${artifact}",
              "--compat.trailing-slash=true"
            ]
          },
          "request": {
            "type": "string",
            "description": "Pins the HTTP method and path under test.",
            "const": "GET /api/greeting/"
          },
          "normalization": {
            "type": "string",
            "description": "Excludes only Spring error timestamp; hashes canonical status/body JSON.",
            "const": "status-body-json-v1"
          },
          "expected_output_sha256": {
            "type": "string",
            "description": "Makes acceptance a byte-level comparison against measured baseline, not human discretion.",
            "pattern": "^0x[0-9a-f]{64}$"
          }
        }
      }
    },
    "bond": {
      "type": "object",
      "description": "Defines the exact test-coin liability.",
      "additionalProperties": false,
      "required": [
        "amount_wei",
        "currency",
        "decimals"
      ],
      "properties": {
        "amount_wei": {
          "type": "string",
          "description": "Avoids floating point rounding and prevents a zero-value guarantee.",
          "pattern": "^[1-9][0-9]*$",
          "maxLength": 18
        },
        "currency": {
          "type": "string",
          "description": "Names the testnet native currency, never real ETH.",
          "const": "Base Sepolia ETH"
        },
        "decimals": {
          "type": "integer",
          "minimum": 0,
          "description": "Defines raw-amount interpretation.",
          "const": 18
        }
      }
    },
    "oracle": {
      "type": "object",
      "description": "Makes the off-chain trust boundary explicit.",
      "additionalProperties": false,
      "required": [
        "kind",
        "address",
        "runner_sha256",
        "evidence_commitment",
        "relay_validation"
      ],
      "properties": {
        "kind": {
          "type": "string",
          "description": "Current version trusts a named runner; this is not a proof of Java execution.",
          "const": "named-runner"
        },
        "address": {
          "type": "string",
          "description": "Only this signer may post harness verdict and evidence hash.",
          "pattern": "^0x[0-9a-fA-F]{40}$",
          "not": {
            "const": "0x0000000000000000000000000000000000000000"
          }
        },
        "runner_sha256": {
          "type": "string",
          "description": "Pins the adjudicator implementation used for replay.",
          "pattern": "^0x[0-9a-f]{64}$"
        },
        "evidence_commitment": {
          "type": "string",
          "description": "Records the full canonical evidence SHA-256 in the Reported and Settled events.",
          "const": "sha256-canonical-json-onchain-event"
        },
        "relay_validation": {
          "type": "string",
          "description": "Existing live relay has no bond verbs; no fictional relay verification is claimed.",
          "const": "unsupported-direct-testnet-client"
        }
      }
    },
    "starts_at": {
      "type": "integer",
      "minimum": 1,
      "description": "Bounds when covered failures may be submitted."
    },
    "expires_at": {
      "type": "integer",
      "minimum": 1,
      "description": "Pass replay happens after this Unix timestamp; end must follow start."
    },
    "release_condition": {
      "type": "string",
      "description": "Locks the acceptance predicate and earliest release.",
      "const": "pass-replay-after-expiry-and-dispute-window"
    },
    "slash_condition": {
      "type": "string",
      "description": "Defines compensable behavioral or artifact mismatch; infrastructure failures block.",
      "const": "replay-output-or-artifact-hash-mismatch"
    },
    "dispute": {
      "type": "object",
      "description": "States what a challenge window actually permits.",
      "additionalProperties": false,
      "required": [
        "seconds",
        "policy",
        "unavailable_oracle"
      ],
      "properties": {
        "seconds": {
          "type": "integer",
          "minimum": 1,
          "description": "Minimum delay after an oracle report before anyone can settle.",
          "maximum": 86400
        },
        "policy": {
          "type": "string",
          "description": "Failure supersedes pass and cannot be erased; no human arbitration.",
          "const": "oracle-rerun-fail-overrides-pass"
        },
        "unavailable_oracle": {
          "type": "string",
          "description": "No-result is not a pass or fail; funds remain locked.",
          "const": "locked-until-report"
        }
      }
    }
  },
  "$comment": "Field rationale and execution protocol: ../docs/BEHAVIOR_CONTRACT.md"
}
